{
  "schema_version": 2,
  "record_type": "source-preparation-input",
  "source_kind": "distribution",
  "workspace_id": "fixture-kernel",
  "campaign_id": "fixture-investigation",
  "baseline_sha256": "1111111111111111111111111111111111111111111111111111111111111111",
  "kernel_srpm_sha256": "2222222222222222222222222222222222222222222222222222222222222222",
  "builder_image_digest": "sha256:3333333333333333333333333333333333333333333333333333333333333333",
  "builder_config_digest": "sha256:4444444444444444444444444444444444444444444444444444444444444444",
  "builder_archive_sha256": "5555555555555555555555555555555555555555555555555555555555555555",
  "source_date_epoch": 1700000000
}
